{
  "report_id": "obs-ejemplo-001",
  "observer": "documentacion_cientifica@1.0.0",
  "release": "R0",
  "fecha": "2026-10-14",
  "artefactos_observados": [
    "sha256:0000000000000000000000000000000000000000000000000000000000000000"
  ],
  "hallazgos": [
    {
      "id": "H1",
      "tipo": "brecha",
      "severidad_sugerida": "S3",
      "descripcion": "EJEMPLO SINTÉTICO: un resultado del T1 no declara cifras significativas para su presentación",
      "evidencia": {
        "artefacto": "sha256:0000000000000000000000000000000000000000000000000000000000000000",
        "ubicacion": "resultados/caudal_pico"
      },
      "recomendacion": "Declarar cifras significativas en la salida del programa",
      "confianza": "media"
    }
  ],
  "resumen": "Ejemplo sintético para probar el esquema; no es un hallazgo real."
}
